{"model_id":"Miku-Nemotron-VoiceChat-v1","base_model":"NVIDIA Nemotron VoiceChat 11B family","version":"1.0.0","stt_languages":["ko","en"],"llm_tuning_mode":"adapter_composition","persona_adapter":"miku-persona-v1","agentic_adapter":"miku-agentic-v1","tts_profile":"miku-static-v1","codec_frozen":true,"training_stage":"definition","evaluation_report":"reports/v0.0.0-validation.md"}
